{
    "_type": "safetyPlan",
    "_rev": 1,
    "assigned": true,
	"assignedDateTime": "2010-01-01T11:11:11Z",
    "reasonsForLiving": "To stare at Mt. Rainier.",
    "settingDistractions": ["Love watching TV.", "Love watching Ted Lasso."],
    "supporters": [
        {
            "name": "Name",
            "address": "Address",
            "phoneNumber": "Number"
        }
    ]
}
